{
  "protocol": "dci.package/v1",
  "package_id": "dci.research",
  "version": "1.0.0",
  "kind": "capability",
  "provides_capabilities": ["research.local-corpus"],
  "requires_capabilities": ["filesystem.read"],
  "requires_policies": ["policy.local-corpus"],
  "emits_events": ["artifact.created", "tool.completed"],
  "consumes_events": ["run.started"],
  "produces_artifacts": ["application/vnd.dci.research+json"],
  "consumes_artifacts": ["text/plain"]
}
