{
  "protocol": "dci.package/v1",
  "package_id": "dci.evaluation",
  "version": "1.0.0",
  "kind": "evaluation",
  "provides_capabilities": [],
  "requires_capabilities": ["research.local-corpus"],
  "requires_policies": ["policy.local-corpus"],
  "emits_events": ["evaluation.completed"],
  "consumes_events": ["research.completed"],
  "produces_artifacts": ["application/vnd.dci.verdict+json"],
  "consumes_artifacts": ["application/vnd.dci.research+json"]
}
